NAME,TYPE,GROUP,LAT,LONG,THUMBNAIL,NOTES,NOTES_NEW,x,y
Lukunor,Atoll,Caroline Islands,5.5185,153.753,http://dpanther2.fiu.edu/worldAtolls/263. Lukunor.jpg,"Rounded triangular platform 75.2 km2; most islands and 1 pass at south. Coral/algal rim all sides, more at NE. Lagoon 52.5 km2, apron  narrow, one central pinnacle/islet, Dx̄ 31.9m, Dmax 57m. Refs: Allen Coral Atlas 05/21; P10; T5.","Rounded triangular platform 75.2 km2; most islands and 1 pass at south. Coral/algal rim all sides, more at NE. Lagoon 52.5 km2, apron  narrow, one central pinnacle/islet, Dx̄ 31.9m, Dmax 57m. Refs: Allen Coral Atlas 05/21; P10; T5.",17115705.667938195,615268.6310971221
Male North,Atoll,Maldive Islands,4.4214,73.5037,http://dpanther2.fiu.edu/worldAtolls/56. Male North.jpg,"Platfrom 1565 km2, Dmax 69m. Ref: Isaack & Gischler 2015.","Platfrom 1565 km2, Dmax 69m. Ref: Isaack & Gischler 2015.",8182394.4554215465,492677.21332233737
Etal,Atoll,Caroline Islands,5.5903,153.5672,http://dpanther2.fiu.edu/worldAtolls/264. Etal.jpg,"Platform 21 km2, rounded triangle shape, rimmed by coral/algae. Islands primarily east and south. Lagoon 15.7 km2, mostly >20m deep, apron narrow (<150m). Coral/algae, esp. SE. No islets/pinnacles.  Ref: Allen Coral Atlas 05/21.","Platform 21 km2, rounded triangle shape, rimmed by coral/algae. Islands primarily east and south. Lagoon 15.7 km2, mostly >20m deep, apron narrow (<150m). Coral/algae, esp. SE. No islets/pinnacles.  Ref: Allen Coral Atlas 05/21.",17095022.506548807,623299.0760308157
Male South,Atoll,Maldive Islands,3.9834,73.4357,http://dpanther2.fiu.edu/worldAtolls/57. Male South.jpg,"lagoon 535 km2,  Dmax 58m. Ref: Isaack & Gischler 2015.","lagoon 535 km2,  Dmax 58m. Ref: Isaack & Gischler 2015.",8174824.730047606,443787.7124551024
Minto,Atoll Reef,Caroline Islands,8.1542,154.2883,http://dpanther2.fiu.edu/worldAtolls/265. Minto.jpg,"Platform 45.3 km2 rimmed with coral/algae, esp. at SW margin. Lagoon 31.6 km2 primarily >20 m by Allen Coral Atlas 05/21.","Platform 45.3 km2 rimmed with coral/algae, esp. at SW margin. Lagoon 31.6 km2 primarily >20 m by Allen Coral Atlas 05/21.",17175294.991359834,910801.2113244191
Rasdhu,Atoll,Maldive Islands,4.2921,72.9834,http://dpanther2.fiu.edu/worldAtolls/58. Rasdhu.jpg,"Lagoon 59 km2, Dmax 37m. Proportion of lagoon sand apron to platform area 21.72% suggests a filling bucket. Ref: Isaack & Gischler 2015.","Lagoon 59 km2, Dmax 37m. Proportion of lagoon sand apron to platform area 21.72% suggests a filling bucket. Ref: Isaack & Gischler 2015.",8124474.92436181,478241.88746516535
Kapingamarangi,Atoll,Caroline Islands,1.065,154.7722,http://dpanther2.fiu.edu/worldAtolls/266. Kapingamarangi.jpg,"Platform 78.1 km2 with narrow coral/algal rim, pass at SW with coral/algal growth that rims most of 54.1 km2 lagoon, Dx̄ 40.1 with coral/sand islets/pinnacles. Dmax 79m. Refs: Allen Coral Atlas 05/21; P10; T5.","Platform 78.1 km2 with narrow coral/algal rim, pass at SW with coral/algal growth that rims most of 54.1 km2 lagoon, Dx̄ 40.1 with coral/sand islets/pinnacles. Dmax 79m. Refs: Allen Coral Atlas 05/21; P10; T5.",17229162.49295471,118562.08518423492
Nukuoro,Atoll,Caroline Islands,3.8478,154.9414,http://dpanther2.fiu.edu/worldAtolls/267. Nukuoro.jpg,"Platform 39.2 km2 with coral/algae on rim and outer reef slope, numerous islands N, E & S. Narrow pass at SW. Lagoon apron thin, limited coral/algae on back reef slope. Dmax 99m (cf. Ngatik); 2 sand/coral pinnacles. Refs: Allen Atlas 05/21; P10.","Platform 39.2 km2 with coral/algae on rim and outer reef slope, numerous islands N, E & S. Narrow pass at SW. Lagoon apron thin, limited coral/algae on back reef slope. Dmax 99m (cf. Ngatik); 2 sand/coral pinnacles. Refs: Allen Atlas 05/21; P10.",17247997.75079692,428657.4677691309
Ari,Atoll,Maldive Islands,3.83,72.85,http://dpanther2.fiu.edu/worldAtolls/59. Ari.jpg,"Platform 2252 km2, Dmax 69m. Ref: Isaack & Gischler 2015.","Platform 2252 km2, Dmax 69m. Ref: Isaack & Gischler 2015.",8109624.904289989,426671.5248512158
Sapwuahfik,Atoll,Caroline Islands,5.8105,157.2732,http://dpanther2.fiu.edu/worldAtolls/268. Ngatik.jpg,"aka Ngatik. Platform 122.3 km2 with coral/algal rim, 1 pass at south lined with coral, 11m deep (NGA 81427). Lagoon 85.9 km2. Cluster of sand/coral pinnacles near center, Dmax 159m: extremely deep atoll lagoon. cf. Nukuroro.  Ref: Allen Atlas; P10.","aka Ngatik. Platform 122.3 km2 with coral/algal rim, 1 pass at south lined with coral, 11m deep (NGA 81427). Lagoon 85.9 km2. Cluster of sand/coral pinnacles near center, Dmax 159m: extremely deep atoll lagoon. cf. Nukuroro.  Ref: Allen Atlas; P10.",17507572.539428685,647933.4633763102
Fetadu,Atoll,Maldive Islands,3.4608,73.466,http://dpanther2.fiu.edu/worldAtolls/60. Fetadu.jpg,"aka Felidu. Platform 1021 km2, Dmax 68m. Ref: Isaack & Gischler 2015.","aka Felidu. Platform 1021 km2, Dmax 68m. Ref: Isaack & Gischler 2015.",8178197.710618644,385488.9709087539
Oraluk,Atoll Reef,Caroline Islands,7.5134,155.3036,http://dpanther2.fiu.edu/worldAtolls/269. Oraluk.jpg,"Platform 453 km2 with thin coral/algal rim, weakest in the lee at SW. Lagoon with coral/algal material at N and at passes west. Apron thin, leading to lagoon with a few coral islets/pinnacles. Dmax 75m. Ref:Allen Coral Atlas 05/21; P10.","Platform 453 km2 with thin coral/algal rim, weakest in the lee at SW. Lagoon with coral/algal material at N and at passes west. Apron thin, leading to lagoon with a few coral islets/pinnacles. Dmax 75m. Ref:Allen Coral Atlas 05/21; P10.",17288317.67036225,838795.3083538593
Vataru,Atoll Reef,Maldive Islands,3.2479,73.4331,http://dpanther2.fiu.edu/worldAtolls/61. Vataru.jpg,"aka Wataru. Platform 43 km2, Dmax 35m. Ref: Isaack & Gischler 2015.","aka Wataru. Platform 43 km2, Dmax 35m. Ref: Isaack & Gischler 2015.",8174535.299371546,361748.36430506414
Pakin,Closed Atoll,Caroline Islands,7.0565,157.8079,http://dpanther2.fiu.edu/worldAtolls/270. Pakin.jpg,"Platform 24 km2, rimmed by coral/algae with coral at W-SW outer slope. Lagoon 13.6 km2 apron >400m in places, Dmax 55m, but 10-20m at NW &SE. Pinnacles prominent along lagoon slope NE-W. Refs: Allen Coral Atlas 05/21; P10.","Platform 24 km2, rimmed by coral/algae with coral at W-SW outer slope. Lagoon 13.6 km2 apron >400m in places, Dmax 55m, but 10-20m at NW &SE. Pinnacles prominent along lagoon slope NE-W. Refs: Allen Coral Atlas 05/21; P10.",17567095.07115584,787519.383534584
Faafu,Atoll,Maldive Islands,3.1951,72.9295,http://dpanther2.fiu.edu/worldAtolls/62. Faafu.jpg,"aka North Nilandu. Platform 594 km2, Dmax 66m Ref: Isaack & Gischler 2015.","aka North Nilandu. Platform 594 km2, Dmax 66m Ref: Isaack & Gischler 2015.",8118474.803808053,355861.3920769595
Ant,Atoll,Caroline Islands,6.7768,157.9598,http://dpanther2.fiu.edu/worldAtolls/271. Ant.jpg,"Platform 95.9 km2 with coral/algal rim; Islands and 1 pass at S. Lagoon 76.4 km2, Dx̄ 27.7, Dmax 67m,  >20m, except coral/algae pinnacles at  SW lagoon slope. Refs: Allen Coral Atlas 05/21; P10; T5.","Platform 95.9 km2 with coral/algal rim; Islands and 1 pass at S. Lagoon 76.4 km2, Dx̄ 27.7, Dmax 67m,  >20m, except coral/algae pinnacles at  SW lagoon slope. Refs: Allen Coral Atlas 05/21; P10; T5.",17584004.501807343,756155.0325740306
Mwoakilloa,Closed Atoll,Caroline Islands,6.6799,159.7566,http://dpanther2.fiu.edu/worldAtolls/272. Mwoakilloa.jpg,"aka Mokil. Platform 8.8 km2 (Allen Atlas). Coral/algal rim & reef slope NW-SW. Lagoon 1.98 km2, shallow area at south with coral; deeper (>20m) with few pinnacle/isets. Dmax 60m, shallower at SE. Refs: Allen Coral Atlas 05/21; P10.","aka Mokil. Platform 8.8 km2 (Allen Atlas). Coral/algal rim & reef slope NW-SW. Lagoon 1.98 km2, shallow area at south with coral; deeper (>20m) with few pinnacle/isets. Dmax 60m, shallower at SE. Refs: Allen Coral Atlas 05/21; P10.",17784023.362864695,745293.3661167484
Mulaku,Atoll,Maldive Islands,2.9917,73.5007,http://dpanther2.fiu.edu/worldAtolls/63. Mulak.jpg,"Platform 956 km2, Dmax 73m. Significant reduction in faro development on rim and in lagoon. Ref: Isaack & Gischler 2015.","Platform 956 km2, Dmax 73m. Significant reduction in faro development on rim and in lagoon. Ref: Isaack & Gischler 2015.",8182060.496949169,333185.95515570126
Pingelap,Closed Atoll,Caroline Islands,6.2174,160.7024,http://dpanther2.fiu.edu/worldAtolls/273. Pingelap.jpg,"Platform 8.15 km2 (29 km2 by Purdy, 2001) coral/algae and rim and on reef slope NE-SW. Rocky lagoon flat at W >600m wide. Lagoon 1.35 km2 rimmed & bisected by coral. Dmax 42m with few pinnacles/islets. Refs: Allen Coral Atlas 05/21; P10.","Platform 8.15 km2 (29 km2 by Purdy, 2001) coral/algae and rim and on reef slope NE-SW. Rocky lagoon flat at W >600m wide. Lagoon 1.35 km2 rimmed & bisected by coral. Dmax 42m with few pinnacles/islets. Refs: Allen Coral Atlas 05/21; P10.",17889309.337256968,693480.1313942663
Parece Vela,Atoll Reef,"Isolated, south of Japan",20.4215,136.0919,http://dpanther2.fiu.edu/worldAtolls/274. Parece Vela.jpg,"aka Okinotori Shima, lagoon ~3.5 km2 by Google Earth; depth 3-4.6m. Ref: Parece link","aka Okinotori Shima, lagoon ~3.5 km2 by Google Earth; depth 3-4.6m. Ref: Parece link",15149681.009089109,2323030.8085287926
Dhaalu,Atoll,Maldive Islands,2.8372,72.934,http://dpanther2.fiu.edu/worldAtolls/64. Dhaalu.jpg,"aka So. Nilandu. Platform 739 km2, Dmax 68m. Ref: Isaack & Gischler 2015.","aka So. Nilandu. Platform 739 km2, Dmax 68m. Ref: Isaack & Gischler 2015.",8118975.741516624,315964.81417904055
Wake,Atoll,"Isolated, Mid-Pacific",19.2977,166.6262,http://dpanther2.fiu.edu/worldAtolls/275. Wake.jpg,"Admin. by U.S. Air Force, 3000 m runway. Lagoon 17 km2, Dmax 26m Ref: Purdy 2001.","Admin. by U.S. Air Force, 3000 m runway. Lagoon 17 km2, Dmax 26m Ref: Purdy 2001.",18548743.736818165,2190016.814486958
Bikini,Atoll,Marshall Islands,11.5904,165.3822,http://dpanther2.fiu.edu/worldAtolls/276. Bikini.jpg,"Platform 799 km2 with six passes at SW, 2 shallow rim areas SW & S. Lagoon 629 km2 with few pinnacles; Dx̄ 46m, Dmax 60m. Site of U.S. nuclear tests 1946-1958. Ref: Allen Coral Atlas 06/21; E2; P10.","Platform 799 km2 with six passes at SW, 2 shallow rim areas SW & S. Lagoon 629 km2 with few pinnacles; Dx̄ 46m, Dmax 60m. Site of U.S. nuclear tests 1946-1958. Ref: Allen Coral Atlas 06/21; E2; P10.",18410262.29027133,1299128.2774609872
Kolomadulu,Atoll,Maldive Islands,2.3764,73.1045,http://dpanther2.fiu.edu/worldAtolls/65. Kolomadulu.jpg,"islands ~7.7% of rim area. Rim continuous except for passes. Lagoon faro development reduced to four at west. Platform 1617 km2, Dmax 79m. Ref: Isaack & Gischler 2015.","islands ~7.7% of rim area. Rim continuous except for passes. Lagoon faro development reduced to four at west. Platform 1617 km2, Dmax 79m. Ref: Isaack & Gischler 2015.",8137955.714696871,264615.5166688809
Enewetak,Atoll,Marshall Islands,11.4948,162.2244,http://dpanther2.fiu.edu/worldAtolls/277. Enewetak.jpg,"Platform 1084 km2 1 pass at E rim; 2 shallower at S & W. Lagoon 932 km2, Dx̄ 48 m; Dmax 64 m, scattered pinnacles at center. Site of U.S. Nuclear tests 1948-1958. Refs: Allen Coral Atlas 07/21; E2; P1; Y1.","Platform 1084 km2 1 pass at E rim; 2 shallower at S & W. Lagoon 932 km2, Dx̄ 48 m; Dmax 64 m, scattered pinnacles at center. Site of U.S. Nuclear tests 1948-1958. Refs: Allen Coral Atlas 07/21; E2; P1; Y1.",18058737.602244336,1288266.46571345
Haddummati,Atoll,Maldive Islands,1.9212,73.4046,http://dpanther2.fiu.edu/worldAtolls/66. Haddummati.jpg,"Platform 881 km2, continuous except for passes; seagrass on rim islands except NW. Dmax 73m. Refs: Allen Coral Atlas, 05/21; Isaack & Gischler 2015.","Platform 881 km2, continuous except for passes; seagrass on rim islands except NW. Dmax 73m. Refs: Allen Coral Atlas, 05/21; Isaack & Gischler 2015.",8171362.693883937,213907.09372469407
Rongelap,Atoll,Marshall Islands,11.3333,166.8131,http://dpanther2.fiu.edu/worldAtolls/278. Rongelap.jpg,"Platform 1146 km2 with 9 passes: 4S, 3 E,1W, 1N. Lagoon 1026 km2 with few pinnacles, Dx̄ 49m, Dmax 62m. Ref: Allen Coral Atlas 07/21; E2, P10.","Platform 1146 km2 with 9 passes: 4S, 3 E,1W, 1N. Lagoon 1026 km2 with few pinnacles, Dx̄ 49m, Dmax 62m. Ref: Allen Coral Atlas 07/21; E2, P10.",18569549.349647433,1269925.6288377172
Rongerik,Atoll Reef,Marshall Islands,11.3565,167.4482,http://dpanther2.fiu.edu/worldAtolls/279. Rongerik.jpg,"Platform 209 km2, islands 3.5% of rim, Lagoon 148 km2 with submerged rim at W and 1 pass at E. Many patch reefs in E lagoon;  Dx̄ 35m, Dmax 49m. Ref: Allen Coral Atlas 07/21; E2; M6; P10.","Platform 209 km2, islands 3.5% of rim, Lagoon 148 km2 with submerged rim at W and 1 pass at E. Many patch reefs in E lagoon;  Dx̄ 35m, Dmax 49m. Ref: Allen Coral Atlas 07/21; E2; M6; P10.",18640248.358250238,1272559.7088495856
Suvadiva,Atoll,Maldive Islands,0.4824,73.275,http://dpanther2.fiu.edu/worldAtolls/67. Suvadiva.jpg,"Platform 3152 km2 with few faros at NW islands, esp. at east with seagrass behind coral and rock, Dmax 82m. Refs: Allen Coral Atlas 05/21; Isaack & Gischler 2015.","Platform 3152 km2 with few faros at NW islands, esp. at east with seagrass behind coral and rock, Dmax 82m. Refs: Allen Coral Atlas 05/21; Isaack & Gischler 2015.",8156935.687877124,53701.156818743824
Ailinginae,Atoll,Marshall Islands,11.1429,166.4339,http://dpanther2.fiu.edu/worldAtolls/280. Ailinginae.jpg,"Platform 157 km2 with 2 passes at S rim. Lagoon 104 km2, scattered pinnacles, more in east lagoon. Dmax 31m. Ref: Allen Coral Atlas 07/21; E2; P10.","Platform 157 km2 with 2 passes at S rim. Lagoon 104 km2, scattered pinnacles, more in east lagoon. Dmax 31m. Ref: Allen Coral Atlas 07/21; E2; P10.",18527336.998738624,1248316.0402268362
Addu,Atoll,Maldive Islands,-0.649,73.1674,http://dpanther2.fiu.edu/worldAtolls/68. Addu.jpg,"Platform 158 km2, no faros; seagrass at NW/NE islands. Lagoon Dmax 79m. Refs: Allen Coral Atlas 05/21; Isaack & Gischler 2015.  Carbonate Evaporites. doi 10.1007/s13146-015-0268-z","Platform 158 km2, no faros; seagrass at NW/NE islands. Lagoon Dmax 79m. Refs: Allen Coral Atlas 05/21; Isaack & Gischler 2015.  Carbonate Evaporites. doi 10.1007/s13146-015-0268-z",8144957.710667769,-72247.89450431317
Wotho,Atoll,Marshall Islands,10.1046,165.9733,http://dpanther2.fiu.edu/worldAtolls/281. Wotho.jpg,"Platform 129.7 km2, much of western rim at or below sea level. Lagoon 97 km2. Dmax 37m. Refs: Allen Coral Atlas 07/21; P10 for depth only, lagoon area listed as 438 km2.","Platform 129.7 km2, much of western rim at or below sea level. Lagoon 97 km2. Dmax 37m. Refs: Allen Coral Atlas 07/21; P10 for depth only, lagoon area listed as 438 km2.",18476063.241279244,1130715.531377616
Pratas,Atoll Reef,South China Sea,20.6842,116.8187,http://dpanther2.fiu.edu/worldAtolls/69. Dongsha.jpg,"aka Dongsha. Platform 424 km2, island 2% of rim. Lagoon ~310 km2 with large areas of seagrass and sand; coral esp. on eastern back reef slope. Typical  lagoon depth 10-15m, Dmax 23.7m. Refs: Allen Coral Atlas 06/21; K3 for depth.","aka Dongsha. Platform 424 km2, island 2% of rim. Lagoon ~310 km2 with large areas of seagrass and sand; coral esp. on eastern back reef slope. Typical  lagoon depth 10-15m, Dmax 23.7m. Refs: Allen Coral Atlas 06/21; K3 for depth.",13004198.199132191,2354262.4012679798
Ujelang,Atoll,Marshall Islands,9.8237,160.8952,http://dpanther2.fiu.edu/worldAtolls/282. Ujelang.jpg,"Platform 107 km2, 3 shallow passes at SW rim. Lagoon 71.5 km2 with few scattered patches, Dmax 49m. Refs: Allen Coral Atlas 07/21; P10.","Platform 107 km2, 3 shallow passes at SW rim. Lagoon 71.5 km2 with few scattered patches, Dmax 49m. Refs: Allen Coral Atlas 07/21; P10.",17910771.735081915,1098966.9645120306
North Reef,Atoll Reef,"Paracel Islands, So. China Sea",17.0923,111.5,http://dpanther2.fiu.edu/worldAtolls/70. Beijiao.jpg,"aka Beijiao. Platform 48.5 km2 with coral/algal rim. Lagoon at platform west, 14.6 km2 with sand/microalgal edge, central 8 km2 with numerous patch reefs, Dmax 20m. Refs: Allen Coral Atlas 05/21; P10 depth only.","aka Beijiao. Platform 48.5 km2 with coral/algal rim. Lagoon at platform west, 14.6 km2 with sand/microalgal edge, central 8 km2 with numerous patch reefs, Dmax 20m. Refs: Allen Coral Atlas 05/21; P10 depth only.",12412123.22345001,1931571.9539004872
Kwajalein,Atoll,Marshall Islands,9.1876,167.4552,http://dpanther2.fiu.edu/worldAtolls/283. Kwajalein.jpg,"Largest atoll in Marshall group. Platform 2304 km2 with several passes and much of rim submerged at W & SW. Lagoon 2174 km2 with few pinnacles, Dmax 61m. Ref: Allen Coral Atlas 06/21; E2; P10.","Largest atoll in Marshall group. Platform 2304 km2 with several passes and much of rim submerged at W & SW. Lagoon 2174 km2 with few pinnacles, Dmax 61m. Ref: Allen Coral Atlas 06/21; E2; P10.",18641027.594685797,1027170.4373142591
Ujae,Atoll Reef,Marshall Islands,9.0679,165.6367,http://dpanther2.fiu.edu/worldAtolls/284. Ujae.jpg,"Platform 261 km2, islands 4% of rim;  NW section at or below sea level; 1 pass at west. Lagoon 205 km2 with scattered pinnacles. Refs: Allen Coral Atlas 07/21.","Platform 261 km2, islands 4% of rim;  NW section at or below sea level; 1 pass at west. Lagoon 205 km2 with scattered pinnacles. Refs: Allen Coral Atlas 07/21.",18438593.10067822,1013674.5950882058
Amphitrite,Atoll Reef,"Paracel Islands, So. China Sea",16.9603,112.285,http://dpanther2.fiu.edu/worldAtolls/71. Xuande.jpg,"aka Xuande. Platform 375 km2, rim not clearly defined as an atoll. Dmax 67m. Ref: P10.","aka Xuande. Platform 375 km2, rim not clearly defined as an atoll. Dmax 67m. Ref: P10.",12499509.023722732,1916204.2162347606
Crescent,Atoll Reef,"Paracel Islands, So. China Sea",16.5,111.6799,http://dpanther2.fiu.edu/worldAtolls/72. Yongle.jpg,"aka Yongle. Continental slope atoll. Platform 300 km2, 8 islands incl. one at W, rimmed by coral/algae. Part of S rim submerged. Lagoon with patch reefs & sand bars at shallower E/NE lagoon, but ~75% >20m, Dmax 49m. Refs: Allen Coral Atlas 05/21; P10; W1","aka Yongle. Continental slope atoll. Platform 300 km2, 8 islands incl. one at W, rimmed by coral/algae. Part of S rim submerged. Lagoon with patch reefs & sand bars at shallower E/NE lagoon, but ~75% >20m, Dmax 49m. Refs: Allen Coral Atlas 05/21; P10; W1",12432149.599843722,1862698.872150694
Lae,Atoll,Marshall Islands,8.9374,166.2406,http://dpanther2.fiu.edu/worldAtolls/285. Lae.jpg,"Platform 28.1 km2, shallow channel in western rim; lagoon 17.1 km2, Dmax 66m. Ref: Allen Coral Atlas 07/21; P10 depth only.","Platform 28.1 km2, shallow channel in western rim; lagoon 17.1 km2, Dmax 66m. Ref: Allen Coral Atlas 07/21; P10 depth only.",18505818.941168286,998966.2071442327
Vuladdore,Atoll Reef,"Paracel Islands, So. China Sea",16.3456,112.0181,http://dpanther2.fiu.edu/worldAtolls/73. Yuzhou.jpg,"aka Yuzhuo. Platform 50.9 km2, coral/algal rim NE-SW. Lagoon 17.2 km2, mostly sand with microalgal edge. Deeper area 6.4 km2, Dmax 17m with reticulated sand ridges. Refs: Allen Coral Atlas 05/21; P10.","aka Yuzhuo. Platform 50.9 km2, coral/algal rim NE-SW. Lagoon 17.2 km2, mostly sand with microalgal edge. Deeper area 6.4 km2, Dmax 17m with reticulated sand ridges. Refs: Allen Coral Atlas 05/21; P10.",12469797.851630012,1844780.0775324304
Lib,"Closed Atoll, Altered Salinity/Oxygen",Marshall Islands,8.3132,167.3805,http://dpanther2.fiu.edu/worldAtolls/286. Lib.jpg,"Platform 2.1 km2 with a remnant 12 ha pond-like mesohaline lagoon, Dx̄ 2.3m, Dmax 3.3m; x̄ salinity ~27‰. Refs: Allen Coral Atlas 06/21; M5.","Platform 2.1 km2 with a remnant 12 ha pond-like mesohaline lagoon, Dx̄ 2.3m, Dmax 3.3m; x̄ salinity ~27‰. Refs: Allen Coral Atlas 06/21; M5.",18632712.028723538,928685.3630955276
Discovery,Atoll Reef,"Paracel Islands, So. China Sea",16.2281,111.6864,http://dpanther2.fiu.edu/worldAtolls/74. Huaguang.jpg,"aka Huaguang. Platform 194-206 km2 (deeper reef slope outline unclear), thin coral rim with two passes at S. Lagoon 143 km2, sandy with microalgal edge. Numerous patch reefs approaching deeper lagoon, Dmax 30m. Refs: Allen Coral Atlas 05/21; P10.","aka Huaguang. Platform 194-206 km2 (deeper reef slope outline unclear), thin coral rim with two passes at S. Lagoon 143 km2, sandy with microalgal edge. Numerous patch reefs approaching deeper lagoon, Dmax 30m. Refs: Allen Coral Atlas 05/21; P10.",12432873.176533874,1831153.1830832514
Namu,Atoll,Marshall Islands,7.9867,168.1679,http://dpanther2.fiu.edu/worldAtolls/287. Namu.jpg,"Platform 462 km2; islands 6% of rim with multiple hoa and 3 passes at west. Lagoon 406 km2, Dmax 49m. Refs: Allen Coral Atlas 06/21; P10.","Platform 462 km2; islands 6% of rim with multiple hoa and 3 passes at west. Lagoon 406 km2, Dmax 49m. Refs: Allen Coral Atlas 06/21; P10.",18720364.995774154,891968.6759539868
Passau Keah,Atoll Reef,"Paracel Islands, So. China Sea",16.0519,111.7866,http://dpanther2.fiu.edu/worldAtolls/75. Panshiu.jpg,"aka Panshiyu. Continental slope atoll. Platform 28.9 km2 rimmed by coral/algae. Lagoon 10.4 km2 primarily sand with shallow rim of microalgae esp. at S, leading to a 6.7 km2 area Dmax 11m. Refs: Allen Coral Atlas 05/21; P10; W1.","aka Panshiyu. Continental slope atoll. Platform 28.9 km2 rimmed by coral/algae. Lagoon 10.4 km2 primarily sand with shallow rim of microalgae esp. at S, leading to a 6.7 km2 area Dmax 11m. Refs: Allen Coral Atlas 05/21; P10; W1.",12444027.389511365,1810733.858598165
Ailinglaplap,Atoll,Marshall Islands,7.3947,168.7634,http://dpanther2.fiu.edu/worldAtolls/288. Ailinglaplap.jpg,"Platform 819 km2; 4 passes at NW, 1 at south. Lagoon 759 km2 with >20 pinnacles,  Dmax 62m. Refs: Allen Coral Atlas 06/21; P10.","Platform 819 km2; 4 passes at NW, 1 at south. Lagoon 759 km2 with >20 pinnacles,  Dmax 62m. Refs: Allen Coral Atlas 06/21; P10.",18786655.75254155,825469.0652274364
Bombay Reef,Atoll Reef,"Paracel Islands, So. China Sea",16.0433,112.5246,http://dpanther2.fiu.edu/worldAtolls/76. Langhua.jpg,"aka Langhua. Platform 80.5 km2 with coral/algal rim. Lagoon 39.4 km2 shallow, sand & micro algae; ~17 km2 deeper with coral plateau areas, Dmax 17m. Refs: Allen Coral Atlas 05/21; P10.","aka Langhua. Platform 80.5 km2 with coral/algal rim. Lagoon 39.4 km2 shallow, sand & micro algae; ~17 km2 deeper with coral plateau areas, Dmax 17m. Refs: Allen Coral Atlas 05/21; P10.",12526181.1737168,1809737.692755452
Scarborough,Atoll Reef,South China Sea,15.1462,117.7701,http://dpanther2.fiu.edu/worldAtolls/77. Huangyan Dao.jpg,"aka Huangyan Dao. Platform 129.2 km2 with coral/algal rim. Lagoon 102.7 km2 rimmed with seagrass, sand & microalgae. Apparent depth mostly 10-20m with central coral plateau and back reef slope at NE. Ref: Allen Coral Atlas 05/21.","aka Huangyan Dao. Platform 129.2 km2 with coral/algal rim. Lagoon 102.7 km2 rimmed with seagrass, sand & microalgae. Apparent depth mostly 10-20m with central coral plateau and back reef slope at NE. Ref: Allen Coral Atlas 05/21.",13110107.562672915,1706054.9467276467
Jaluit,Atoll,Marshall Islands,6.0064,169.5537,http://dpanther2.fiu.edu/worldAtolls/289. Jaluit.jpg,"Platform 855 km2, passes E/SE/SW. Lagoon 795 km2 with very narrow apron, but sediment spits and embayments along western margin; Dmax 49m. Refs: Allen Coral Atlas 06/21; P10.","Platform 855 km2, passes E/SE/SW. Lagoon 795 km2 with very narrow apron, but sediment spits and embayments along western margin; Dmax 49m. Refs: Allen Coral Atlas 06/21; P10.",18874631.546115477,669857.4303368354
Namorik,Closed Atoll,Marshall Islands,5.6137,168.1155,http://dpanther2.fiu.edu/worldAtolls/290. Namorik.jpg,aka Namdrick. Platform 23.4 km2. Lagoon 10.7 km2. Ref: Allen Coral Atlas 06/21.,aka Namdrick. Platform 23.4 km2. Lagoon 10.7 km2. Ref: Allen Coral Atlas 06/21.,18714531.854456596,625916.4527430926
North Danger,Atoll Reef,"Spratly Islands, So. China Sea",11.4107,114.3549,http://dpanther2.fiu.edu/worldAtolls/78. Shuangzi.jpg,"aka Shuangzi. Platform 73 km2 with most of E & S rim submerged. Four islands rimmed with coral/algae. Lagoon 54.2 km2, Dmax 48m. Ref: Allen Coral Atlas 05/21; P10, depth only.","aka Shuangzi. Platform 73 km2 with most of E & S rim submerged. Four islands rimmed with coral/algae. Lagoon 54.2 km2, Dmax 48m. Ref: Allen Coral Atlas 05/21; P10, depth only.",12729929.237715725,1278714.3003991824
Ebon,Atoll,Marshall Islands,4.6349,168.7192,http://dpanther2.fiu.edu/worldAtolls/291. Ebon.jpg,Platform 129 km2 with sinuous channel at SW. Lagoon 107 km2 Dmax 33m  Ref: Allen Coral Atlas 06/21; P10.,Platform 129 km2 with sinuous channel at SW. Lagoon 107 km2 Dmax 33m  Ref: Allen Coral Atlas 06/21; P10.,18781735.431048494,516518.3547026461
Bokaak,Closed Atoll,Marshall Islands,14.6559,168.9733,http://dpanther2.fiu.edu/worldAtolls/292. Bokaak.jpg,"aka Taongi. Platform 114.1 km2, west rim awash at low tide. Lagoon 95.1 km2 with subm. apron; 73.8 without. Pinnacles at east; ribbon reefs east central. Dx̄ 13m; Dmax 15m. Refs: Allen Coral Atlas 06/21; M6.","aka Taongi. Platform 114.1 km2, west rim awash at low tide. Lagoon 95.1 km2 with subm. apron; 73.8 without. Pinnacles at east; ribbon reefs east central. Dx̄ 13m; Dmax 15m. Refs: Allen Coral Atlas 06/21; M6.",18810021.713659067,1649575.4831172563
Thitu East,Atoll Reef,"Spratly Islands, So. China Sea",11.07,114.35,http://dpanther2.fiu.edu/worldAtolls/79.  Zhongya.jpg,"aka Zhongye. Platform 20.6 km2, submerged at NW & SE, coral/algal rim except SE. Lagoon ~8 km2 with patch reef/algae, esp. at NW. Dmax 11m. Refs: Allen Coral Atlas 05/21; P10 depth only.","aka Zhongye. Platform 20.6 km2, submerged at NW & SE, coral/algal rim except SE. Lagoon ~8 km2 with patch reef/algae, esp. at NW. Dmax 11m. Refs: Allen Coral Atlas 05/21; P10 depth only.",12729383.772210835,1240045.9582681896
